book_id,user_id,rating,id,best_book_id,work_id,books_count,isbn,isbn13,authors,original_publication_year,original_title,title,language_code,average_rating,ratings_count,work_ratings_count,work_text_reviews_count,ratings_1,ratings_2,ratings_3,ratings_4,ratings_5,image_url,small_image_url,genres,description,rank
291,1994,4,291,291,291,1,1412425762,3000586854318,Jennifer Thomas,1931.0,The Wandering Inn: Book 2 - Fae and Fare,The Wandering Inn: Book 2 - Fae and Fare,eng,3.0,4924,4924,492,492,738,1969,1231,494,https://example.com/bookcovers/291.jpg,https://example.com/bookcovers/small/291.jpg,"Historical Fiction, Self-help, Mystery",This is a fictional description for the book 'The Wandering Inn: Book 2 - Fae and Fare' by Jennifer Thomas.,0
457,1704,5,457,457,457,1,2010858659,7082311647924,"Michelle Davis, David Davis, Emily Thomas",1983.0,Mimis Village And How Basic Health Care Transformed It,Mimis Village And How Basic Health Care Transformed It,eng,1.85,3752,3752,375,1125,938,750,562,377,https://example.com/bookcovers/457.jpg,https://example.com/bookcovers/small/457.jpg,"Science Fiction, Young Adult","This is a fictional description for the book 'Mimis Village And How Basic Health Care Transformed It' by Michelle Davis, David Davis, Emily Thomas.",1
245,965,5,245,245,245,1,4901953835,8197038999441,John Johnson,1900.0,The Bay,The Bay,eng,1.08,3172,3172,317,951,793,634,475,319,https://example.com/bookcovers/245.jpg,https://example.com/bookcovers/small/245.jpg,"Fantasy, Horror, Young Adult",This is a fictional description for the book 'The Bay' by John Johnson.,2
456,1985,1,456,456,456,1,2207971484,168339981822,"Emily Davis, Linda Davis, David Moore",1911.0,The Gumma wars,The Gumma wars,eng,3.28,366,366,36,36,54,146,91,39,https://example.com/bookcovers/456.jpg,https://example.com/bookcovers/small/456.jpg,Fantasy,"This is a fictional description for the book 'The Gumma wars' by Emily Davis, Linda Davis, David Moore.",3
211,635,2,211,211,211,1,5358965365,1598287008362,"John Brown, Jennifer Davis, Linda Thomas",1938.0,Something Special,Something Special,eng,1.59,6954,6954,695,2086,1738,1390,1043,697,https://example.com/bookcovers/211.jpg,https://example.com/bookcovers/small/211.jpg,"Thriller, Non-fiction","This is a fictional description for the book 'Something Special' by John Brown, Jennifer Davis, Linda Thomas.",4
