book_id,user_id,rating,id,best_book_id,work_id,books_count,isbn,isbn13,authors,original_publication_year,original_title,title,language_code,average_rating,ratings_count,work_ratings_count,work_text_reviews_count,ratings_1,ratings_2,ratings_3,ratings_4,ratings_5,image_url,small_image_url,genres,description,rank
82,1007,4,82,82,82,1,4253219317,4945516661890,James Taylor,1932.0,"Das einzige Kind, Im Zeichen des Löwen","Das einzige Kind, Im Zeichen des Löwen",eng,4.95,7238,7238,723,72,289,723,1809,4345,https://example.com/bookcovers/82.jpg,https://example.com/bookcovers/small/82.jpg,"Self-help, Non-fiction","This is a fictional description for the book 'Das einzige Kind, Im Zeichen des Löwen' by James Taylor.",0
18,1121,4,18,18,18,1,5116709681,8498613688767,John Johnson,1952.0,A Colorado Match                            Love Inspired,A Colorado Match                            Love Inspired,eng,1.43,8871,8871,887,2661,2217,1774,1330,889,https://example.com/bookcovers/18.jpg,https://example.com/bookcovers/small/18.jpg,"Fantasy, Romance",This is a fictional description for the book 'A Colorado Match                            Love Inspired' by John Johnson.,1
358,870,5,358,358,358,1,1874013111,6884607673287,"Michelle Johnson, Robert Brown",1987.0,World War II,World War II,eng,3.39,9927,9927,992,992,1489,3970,2481,995,https://example.com/bookcovers/358.jpg,https://example.com/bookcovers/small/358.jpg,"Self-help, Biography","This is a fictional description for the book 'World War II' by Michelle Johnson, Robert Brown.",2
146,1753,5,146,146,146,1,6340533529,3740986341830,Linda Thomas,1938.0,The Boyband Murder Mystery,The Boyband Murder Mystery,eng,4.21,6849,6849,684,136,547,1027,2397,2742,https://example.com/bookcovers/146.jpg,https://example.com/bookcovers/small/146.jpg,"Science Fiction, Self-help",This is a fictional description for the book 'The Boyband Murder Mystery' by Linda Thomas.,3
122,1906,4,122,122,122,1,2201969432,9624121860327,Michelle Davis,1997.0,When the Night Falls,When the Night Falls,eng,1.16,5645,5645,564,1693,1411,1129,846,566,https://example.com/bookcovers/122.jpg,https://example.com/bookcovers/small/122.jpg,"Mystery, Biography, Science Fiction",This is a fictional description for the book 'When the Night Falls' by Michelle Davis.,4
