book_id,user_id,rating,id,best_book_id,work_id,books_count,isbn,isbn13,authors,original_publication_year,original_title,title,language_code,average_rating,ratings_count,work_ratings_count,work_text_reviews_count,ratings_1,ratings_2,ratings_3,ratings_4,ratings_5,image_url,small_image_url,genres,description,rank
307,1588,4,307,307,307,1,460793278,2707330484165,"John Davis, Linda Thomas, Sarah Anderson",1906.0,Mimis Village And How Basic Health Care Transformed It,Mimis Village And How Basic Health Care Transformed It,eng,4.49,7144,7144,714,142,571,1071,2500,2860,https://example.com/bookcovers/307.jpg,https://example.com/bookcovers/small/307.jpg,"Literary Fiction, Self-help, Biography","This is a fictional description for the book 'Mimis Village And How Basic Health Care Transformed It' by John Davis, Linda Thomas, Sarah Anderson.",0
304,1250,4,304,304,304,1,5800902884,2426228983087,John Smith,1971.0,A Life's Work: Learning to Overrule My Mindless Brain,A Life's Work: Learning to Overrule My Mindless Brain,eng,3.82,7655,7655,765,382,765,1913,3062,1533,https://example.com/bookcovers/304.jpg,https://example.com/bookcovers/small/304.jpg,Self-help,This is a fictional description for the book 'A Life's Work: Learning to Overrule My Mindless Brain' by John Smith.,1
437,47,5,437,437,437,1,1443090890,131575905905,Robert Moore,1965.0,Walking and climbing,Walking and climbing,eng,4.63,7415,7415,741,74,296,741,1853,4451,https://example.com/bookcovers/437.jpg,https://example.com/bookcovers/small/437.jpg,"Non-fiction, Biography",This is a fictional description for the book 'Walking and climbing' by Robert Moore.,2
357,1043,5,357,357,357,1,3611398347,7086036795781,Robert Davis,2002.0,Mimis Village And How Basic Health Care Transformed It,Mimis Village And How Basic Health Care Transformed It,eng,2.63,8889,8889,888,2666,2222,1777,1333,891,https://example.com/bookcovers/357.jpg,https://example.com/bookcovers/small/357.jpg,"Fantasy, Romance, Literary Fiction",This is a fictional description for the book 'Mimis Village And How Basic Health Care Transformed It' by Robert Davis.,3
453,200,5,453,453,453,1,3970847579,7683943476029,"John Miller, John Wilson",2016.0,Die Prüfungen der Engel,Die Prüfungen der Engel,eng,2.55,9290,9290,929,2787,2322,1858,1393,930,https://example.com/bookcovers/453.jpg,https://example.com/bookcovers/small/453.jpg,Non-fiction,"This is a fictional description for the book 'Die Prüfungen der Engel' by John Miller, John Wilson.",4
