book_id,user_id,rating,id,best_book_id,work_id,books_count,isbn,isbn13,authors,original_publication_year,original_title,title,language_code,average_rating,ratings_count,work_ratings_count,work_text_reviews_count,ratings_1,ratings_2,ratings_3,ratings_4,ratings_5,image_url,small_image_url,genres,description,rank
379,1905,5,379,379,379,1,5788598467,9646720975769,Jennifer Thomas,1928.0,Moving Up On Manolos,Moving Up On Manolos,eng,1.59,9101,9101,910,2730,2275,1820,1365,911,https://example.com/bookcovers/379.jpg,https://example.com/bookcovers/small/379.jpg,Historical Fiction,This is a fictional description for the book 'Moving Up On Manolos' by Jennifer Thomas.,0
187,102,5,187,187,187,1,6043975509,8240459307811,"Michelle Taylor, Robert Johnson",2010.0,Walking and climbing,Walking and climbing,eng,2.78,8391,8391,839,2517,2097,1678,1258,841,https://example.com/bookcovers/187.jpg,https://example.com/bookcovers/small/187.jpg,Young Adult,"This is a fictional description for the book 'Walking and climbing' by Michelle Taylor, Robert Johnson.",1
241,1195,4,241,241,241,1,4750841107,6511657161825,"Michael Miller, Sarah Brown, John Brown",2024.0,The Wandering Inn: Book 2 - Fae and Fare,The Wandering Inn: Book 2 - Fae and Fare,eng,2.54,8426,8426,842,2527,2106,1685,1263,845,https://example.com/bookcovers/241.jpg,https://example.com/bookcovers/small/241.jpg,"Mystery, Young Adult","This is a fictional description for the book 'The Wandering Inn: Book 2 - Fae and Fare' by Michael Miller, Sarah Brown, John Brown.",2
95,1979,5,95,95,95,1,9714678385,3758970100154,"Sarah Thomas, Linda Thomas, Robert Davis",1922.0,The Bay,The Bay,eng,1.37,7820,7820,782,2346,1955,1564,1173,782,https://example.com/bookcovers/95.jpg,https://example.com/bookcovers/small/95.jpg,Non-fiction,"This is a fictional description for the book 'The Bay' by Sarah Thomas, Linda Thomas, Robert Davis.",3
247,1985,4,247,247,247,1,8042633976,1765316482943,David Smith,1949.0,Misfortune Cookie,Misfortune Cookie,eng,1.91,4097,4097,409,1229,1024,819,614,411,https://example.com/bookcovers/247.jpg,https://example.com/bookcovers/small/247.jpg,"Literary Fiction, Horror, Self-help",This is a fictional description for the book 'Misfortune Cookie' by David Smith.,4
