book_id,user_id,rating,id,best_book_id,work_id,books_count,isbn,isbn13,authors,original_publication_year,original_title,title,language_code,average_rating,ratings_count,work_ratings_count,work_text_reviews_count,ratings_1,ratings_2,ratings_3,ratings_4,ratings_5,image_url,small_image_url,genres,description,rank
478,1769,5,478,478,478,1,5299252218,3382149198470,"Sarah Davis, Emily Anderson",1927.0,Hunt for the Shadow Wolf: The lost history of wolves in Britain and the myths and stories that surround them,Hunt for the Shadow Wolf: The lost history of wolves in Britain and the myths and stories that surround them,eng,3.8,2135,2135,213,106,213,533,854,429,https://example.com/bookcovers/478.jpg,https://example.com/bookcovers/small/478.jpg,"Thriller, Science Fiction","This is a fictional description for the book 'Hunt for the Shadow Wolf: The lost history of wolves in Britain and the myths and stories that surround them' by Sarah Davis, Emily Anderson.",0
63,1755,5,63,63,63,1,7382972661,4086374751568,Jennifer Smith,2020.0,Alacrity,Alacrity,eng,1.26,9658,9658,965,2897,2414,1931,1448,968,https://example.com/bookcovers/63.jpg,https://example.com/bookcovers/small/63.jpg,Non-fiction,This is a fictional description for the book 'Alacrity' by Jennifer Smith.,1
497,480,2,497,497,497,1,3214973041,5590493405136,Robert Brown,1996.0,Misfortune Cookie,Misfortune Cookie,eng,1.94,1143,1143,114,342,285,228,171,117,https://example.com/bookcovers/497.jpg,https://example.com/bookcovers/small/497.jpg,"Biography, Mystery",This is a fictional description for the book 'Misfortune Cookie' by Robert Brown.,2
265,1988,5,265,265,265,1,4791438369,3546410291950,"Michelle Wilson, Michael Anderson, Emily Davis",1948.0,Bitter Sweet Distraction,Bitter Sweet Distraction,eng,3.99,2288,2288,228,114,228,572,915,459,https://example.com/bookcovers/265.jpg,https://example.com/bookcovers/small/265.jpg,"Non-fiction, Fantasy","This is a fictional description for the book 'Bitter Sweet Distraction' by Michelle Wilson, Michael Anderson, Emily Davis.",3
500,1559,4,500,500,500,1,9510931574,2941607766775,Jennifer Smith,1915.0,The Height of the Scream,The Height of the Scream,eng,3.49,3899,3899,389,389,584,1559,974,393,https://example.com/bookcovers/500.jpg,https://example.com/bookcovers/small/500.jpg,Non-fiction,This is a fictional description for the book 'The Height of the Scream' by Jennifer Smith.,4
