book_id,user_id,rating,id,best_book_id,work_id,books_count,isbn,isbn13,authors,original_publication_year,original_title,title,language_code,average_rating,ratings_count,work_ratings_count,work_text_reviews_count,ratings_1,ratings_2,ratings_3,ratings_4,ratings_5,image_url,small_image_url,genres,description,rank
474,1359,2,474,474,474,1,4530469785,5985055477353,"Robert Moore, Michelle Smith",1971.0,We Are Theologians: Strengthening the People of God,We Are Theologians: Strengthening the People of God,eng,3.56,1349,1349,134,67,134,337,539,272,https://example.com/bookcovers/474.jpg,https://example.com/bookcovers/small/474.jpg,Science Fiction,"This is a fictional description for the book 'We Are Theologians: Strengthening the People of God' by Robert Moore, Michelle Smith.",0
347,675,3,347,347,347,1,9503625697,1203873754422,"David Miller, John Moore, Linda Johnson",1916.0,Misfortune Cookie,Misfortune Cookie,eng,3.5,8711,8711,871,435,871,2177,3484,1744,https://example.com/bookcovers/347.jpg,https://example.com/bookcovers/small/347.jpg,Young Adult,"This is a fictional description for the book 'Misfortune Cookie' by David Miller, John Moore, Linda Johnson.",1
27,540,4,27,27,27,1,9903768068,8269625128518,"James Brown, Linda Taylor",1965.0,Economics For Dummies,Economics For Dummies,eng,3.13,7065,7065,706,706,1059,2826,1766,708,https://example.com/bookcovers/27.jpg,https://example.com/bookcovers/small/27.jpg,"Literary Fiction, Young Adult, Historical Fiction","This is a fictional description for the book 'Economics For Dummies' by James Brown, Linda Taylor.",2
85,1196,2,85,85,85,1,5830110962,9646194247056,"Michelle Moore, David Miller",1994.0,The Discerning Heart: Exploring the Christian Path,The Discerning Heart: Exploring the Christian Path,eng,1.24,7681,7681,768,2304,1920,1536,1152,769,https://example.com/bookcovers/85.jpg,https://example.com/bookcovers/small/85.jpg,"Science Fiction, Thriller, Young Adult","This is a fictional description for the book 'The Discerning Heart: Exploring the Christian Path' by Michelle Moore, David Miller.",3
425,1491,2,425,425,425,1,359318258,8570952387270,"Robert Wilson, Linda Brown",2018.0,Girls out late (Girls #3),Girls out late (Girls #3),eng,2.27,1109,1109,110,332,277,221,166,113,https://example.com/bookcovers/425.jpg,https://example.com/bookcovers/small/425.jpg,"Literary Fiction, Science Fiction","This is a fictional description for the book 'Girls out late (Girls #3)' by Robert Wilson, Linda Brown.",4
