book_id,user_id,rating,id,best_book_id,work_id,books_count,isbn,isbn13,authors,original_publication_year,original_title,title,language_code,average_rating,ratings_count,work_ratings_count,work_text_reviews_count,ratings_1,ratings_2,ratings_3,ratings_4,ratings_5,image_url,small_image_url,genres,description,rank
193,655,3,193,193,193,1,7678940277,1212818161939,"James Thomas, Jennifer Brown, John Taylor",1915.0,"The Enlightened Way to Financial Freedom: From Crypto Trading to Private Label, from Startup to Real Estate Investing. The All-in-One Guide to Be Young and Rich","The Enlightened Way to Financial Freedom: From Crypto Trading to Private Label, from Startup to Real Estate Investing. The All-in-One Guide to Be Young and Rich",eng,2.08,1836,1836,183,550,459,367,275,185,https://example.com/bookcovers/193.jpg,https://example.com/bookcovers/small/193.jpg,"Mystery, Literary Fiction, Non-fiction","This is a fictional description for the book 'The Enlightened Way to Financial Freedom: From Crypto Trading to Private Label, from Startup to Real Estate Investing. The All-in-One Guide to Be Young and Rich' by James Thomas, Jennifer Brown, John Taylor.",0
308,1741,4,308,308,308,1,9402630953,3110099664932,"Sarah Davis, John Anderson",1918.0,World War II,World War II,eng,3.91,104,104,10,5,10,26,41,22,https://example.com/bookcovers/308.jpg,https://example.com/bookcovers/small/308.jpg,"Young Adult, Historical Fiction","This is a fictional description for the book 'World War II' by Sarah Davis, John Anderson.",1
227,236,5,227,227,227,1,8527168257,6954181159332,"Emily Anderson, John Davis, David Miller",2002.0,Economics For Dummies,Economics For Dummies,eng,1.62,7899,7899,789,2369,1974,1579,1184,793,https://example.com/bookcovers/227.jpg,https://example.com/bookcovers/small/227.jpg,"Horror, Biography, Science Fiction","This is a fictional description for the book 'Economics For Dummies' by Emily Anderson, John Davis, David Miller.",2
159,804,5,159,159,159,1,1180306270,5033282829331,"John Wilson, Robert Wilson, John Anderson",1932.0,Ninna nanna,Ninna nanna,eng,1.33,8520,8520,852,2556,2130,1704,1278,852,https://example.com/bookcovers/159.jpg,https://example.com/bookcovers/small/159.jpg,"Young Adult, Horror, Romance","This is a fictional description for the book 'Ninna nanna' by John Wilson, Robert Wilson, John Anderson.",3
382,54,5,382,382,382,1,7101612492,7624427955706,"Robert Thomas, Michelle Moore",2021.0,"Das einzige Kind, Im Zeichen des Löwen","Das einzige Kind, Im Zeichen des Löwen",eng,2.76,9576,9576,957,2872,2394,1915,1436,959,https://example.com/bookcovers/382.jpg,https://example.com/bookcovers/small/382.jpg,"Romance, Non-fiction, Mystery","This is a fictional description for the book 'Das einzige Kind, Im Zeichen des Löwen' by Robert Thomas, Michelle Moore.",4
