book_id,user_id,rating,id,best_book_id,work_id,books_count,isbn,isbn13,authors,original_publication_year,original_title,title,language_code,average_rating,ratings_count,work_ratings_count,work_text_reviews_count,ratings_1,ratings_2,ratings_3,ratings_4,ratings_5,image_url,small_image_url,genres,description,rank
422,1635,4,422,422,422,1,6765871114,643569938130,"Sarah Moore, Jennifer Moore, Michelle Taylor",2014.0,When the Night Falls,When the Night Falls,eng,3.39,9759,9759,975,975,1463,3903,2439,979,https://example.com/bookcovers/422.jpg,https://example.com/bookcovers/small/422.jpg,Young Adult,"This is a fictional description for the book 'When the Night Falls' by Sarah Moore, Jennifer Moore, Michelle Taylor.",0
17,367,3,17,17,17,1,6315453573,4638125782032,"Emily Taylor, Emily Miller",1913.0,The Science of Storytelling,The Science of Storytelling,eng,2.17,2218,2218,221,665,554,443,332,224,https://example.com/bookcovers/17.jpg,https://example.com/bookcovers/small/17.jpg,"Science Fiction, Literary Fiction, Non-fiction","This is a fictional description for the book 'The Science of Storytelling' by Emily Taylor, Emily Miller.",1
176,641,4,176,176,176,1,3985990829,9666336992247,"Michelle Taylor, Jennifer Taylor, David Miller",1912.0,What's Luck Got to Do with It?: How Smarter Government Can Rescue the American Dream,What's Luck Got to Do with It?: How Smarter Government Can Rescue the American Dream,eng,4.07,1269,1269,126,25,101,190,444,509,https://example.com/bookcovers/176.jpg,https://example.com/bookcovers/small/176.jpg,Non-fiction,"This is a fictional description for the book 'What's Luck Got to Do with It?: How Smarter Government Can Rescue the American Dream' by Michelle Taylor, Jennifer Taylor, David Miller.",2
65,603,2,65,65,65,1,7082956809,3322922449813,"David Smith, Sarah Anderson",1911.0,Bitter Sweet Distraction,Bitter Sweet Distraction,eng,4.49,6867,6867,686,137,549,1030,2403,2748,https://example.com/bookcovers/65.jpg,https://example.com/bookcovers/small/65.jpg,"Romance, Thriller, Fantasy","This is a fictional description for the book 'Bitter Sweet Distraction' by David Smith, Sarah Anderson.",3
313,1115,4,313,313,313,1,964121938,9927380530783,David Taylor,1972.0,Alacrity,Alacrity,eng,2.38,8680,8680,868,2604,2170,1736,1302,868,https://example.com/bookcovers/313.jpg,https://example.com/bookcovers/small/313.jpg,"Mystery, Literary Fiction, Romance",This is a fictional description for the book 'Alacrity' by David Taylor.,4
