book_id,user_id,rating,id,best_book_id,work_id,books_count,isbn,isbn13,authors,original_publication_year,original_title,title,language_code,average_rating,ratings_count,work_ratings_count,work_text_reviews_count,ratings_1,ratings_2,ratings_3,ratings_4,ratings_5,image_url,small_image_url,genres,description,rank
438,281,4,438,438,438,1,271691665,182337609101,"Sarah Miller, David Miller, John Brown",2019.0,ASURA SOVEREIGN 30,ASURA SOVEREIGN 30,eng,1.39,1339,1339,133,401,334,267,200,137,https://example.com/bookcovers/438.jpg,https://example.com/bookcovers/small/438.jpg,Romance,"This is a fictional description for the book 'ASURA SOVEREIGN 30' by Sarah Miller, David Miller, John Brown.",0
425,1491,2,425,425,425,1,359318258,8570952387270,"Robert Wilson, Linda Brown",2018.0,Girls out late (Girls #3),Girls out late (Girls #3),eng,2.27,1109,1109,110,332,277,221,166,113,https://example.com/bookcovers/425.jpg,https://example.com/bookcovers/small/425.jpg,"Literary Fiction, Science Fiction","This is a fictional description for the book 'Girls out late (Girls #3)' by Robert Wilson, Linda Brown.",1
345,378,4,345,345,345,1,2589129711,3793199045661,Robert Taylor,2019.0,The Bay,The Bay,eng,2.03,2552,2552,255,765,638,510,382,257,https://example.com/bookcovers/345.jpg,https://example.com/bookcovers/small/345.jpg,"Biography, Romance, Historical Fiction",This is a fictional description for the book 'The Bay' by Robert Taylor.,2
412,983,5,412,412,412,1,8822015362,963382429930,"James Taylor, Jennifer Thomas",1967.0,Palatul de hârtie,Palatul de hârtie,eng,3.33,854,854,85,85,128,341,213,87,https://example.com/bookcovers/412.jpg,https://example.com/bookcovers/small/412.jpg,"Historical Fiction, Fantasy","This is a fictional description for the book 'Palatul de hârtie' by James Taylor, Jennifer Thomas.",3
112,491,5,112,112,112,1,8186641015,3033331796605,"David Davis, Michelle Taylor, David Wilson",1977.0,Palatul de hârtie,Palatul de hârtie,eng,3.41,2681,2681,268,268,402,1072,670,269,https://example.com/bookcovers/112.jpg,https://example.com/bookcovers/small/112.jpg,Historical Fiction,"This is a fictional description for the book 'Palatul de hârtie' by David Davis, Michelle Taylor, David Wilson.",4
