book_id,user_id,rating,id,best_book_id,work_id,books_count,isbn,isbn13,authors,original_publication_year,original_title,title,language_code,average_rating,ratings_count,work_ratings_count,work_text_reviews_count,ratings_1,ratings_2,ratings_3,ratings_4,ratings_5,image_url,small_image_url,genres,description,rank
468,211,4,468,468,468,1,4110524970,7659682057959,David Johnson,1957.0,A Colorado Match                            Love Inspired,A Colorado Match                            Love Inspired,eng,2.69,5608,5608,560,1682,1402,1121,841,562,https://example.com/bookcovers/468.jpg,https://example.com/bookcovers/small/468.jpg,"Young Adult, Historical Fiction, Horror",This is a fictional description for the book 'A Colorado Match                            Love Inspired' by David Johnson.,0
296,1970,5,296,296,296,1,604876915,4629124903076,"Michelle Taylor, Michelle Johnson, Jennifer Smith",1908.0,The Boyband Murder Mystery,The Boyband Murder Mystery,eng,2.43,5401,5401,540,1620,1350,1080,810,541,https://example.com/bookcovers/296.jpg,https://example.com/bookcovers/small/296.jpg,"Biography, Young Adult","This is a fictional description for the book 'The Boyband Murder Mystery' by Michelle Taylor, Michelle Johnson, Jennifer Smith.",1
317,1584,3,317,317,317,1,9868087897,3029756600454,"Sarah Johnson, Jennifer Anderson",1986.0,The Science of Storytelling,The Science of Storytelling,eng,1.5,5327,5327,532,1598,1331,1065,799,534,https://example.com/bookcovers/317.jpg,https://example.com/bookcovers/small/317.jpg,"Biography, Non-fiction","This is a fictional description for the book 'The Science of Storytelling' by Sarah Johnson, Jennifer Anderson.",2
476,1116,3,476,476,476,1,8871341087,8908408734032,Linda Wilson,1950.0,What's Luck Got to Do with It?: How Smarter Government Can Rescue the American Dream,What's Luck Got to Do with It?: How Smarter Government Can Rescue the American Dream,eng,1.58,1864,1864,186,559,466,372,279,188,https://example.com/bookcovers/476.jpg,https://example.com/bookcovers/small/476.jpg,"Historical Fiction, Science Fiction, Thriller",This is a fictional description for the book 'What's Luck Got to Do with It?: How Smarter Government Can Rescue the American Dream' by Linda Wilson.,3
246,682,5,246,246,246,1,1057271189,2268825259643,"Linda Wilson, John Anderson, Sarah Wilson",1963.0,The Boyband Murder Mystery,The Boyband Murder Mystery,eng,2.4,5491,5491,549,1647,1372,1098,823,551,https://example.com/bookcovers/246.jpg,https://example.com/bookcovers/small/246.jpg,"Historical Fiction, Romance","This is a fictional description for the book 'The Boyband Murder Mystery' by Linda Wilson, John Anderson, Sarah Wilson.",4
