book_id,user_id,rating,id,best_book_id,work_id,books_count,isbn,isbn13,authors,original_publication_year,original_title,title,language_code,average_rating,ratings_count,work_ratings_count,work_text_reviews_count,ratings_1,ratings_2,ratings_3,ratings_4,ratings_5,image_url,small_image_url,genres,description,rank
51,1569,4,51,51,51,1,8693561108,5340945836205,"Linda Davis, Michelle Davis, James Davis",1931.0,Woodrow Wilson,Woodrow Wilson,eng,1.48,6476,6476,647,1942,1619,1295,971,649,https://example.com/bookcovers/51.jpg,https://example.com/bookcovers/small/51.jpg,"Romance, Thriller, Mystery","This is a fictional description for the book 'Woodrow Wilson' by Linda Davis, Michelle Davis, James Davis.",0
382,54,5,382,382,382,1,7101612492,7624427955706,"Robert Thomas, Michelle Moore",2021.0,"Das einzige Kind, Im Zeichen des Löwen","Das einzige Kind, Im Zeichen des Löwen",eng,2.76,9576,9576,957,2872,2394,1915,1436,959,https://example.com/bookcovers/382.jpg,https://example.com/bookcovers/small/382.jpg,"Romance, Non-fiction, Mystery","This is a fictional description for the book 'Das einzige Kind, Im Zeichen des Löwen' by Robert Thomas, Michelle Moore.",1
432,40,5,432,432,432,1,1023553083,105516531722,"Sarah Anderson, David Moore",1966.0,"Das einzige Kind, Im Zeichen des Löwen","Das einzige Kind, Im Zeichen des Löwen",eng,4.94,3609,3609,360,36,144,360,902,2167,https://example.com/bookcovers/432.jpg,https://example.com/bookcovers/small/432.jpg,Fantasy,"This is a fictional description for the book 'Das einzige Kind, Im Zeichen des Löwen' by Sarah Anderson, David Moore.",2
381,368,2,381,381,381,1,5390106064,9694962868178,"Sarah Taylor, Robert Brown",1949.0,The Abode,The Abode,eng,3.79,8394,8394,839,419,839,2098,3357,1681,https://example.com/bookcovers/381.jpg,https://example.com/bookcovers/small/381.jpg,"Biography, Horror, Mystery","This is a fictional description for the book 'The Abode' by Sarah Taylor, Robert Brown.",3
495,162,4,495,495,495,1,4335807885,2165200696213,John Taylor,2009.0,The Bay,The Bay,eng,4.62,8022,8022,802,80,320,802,2005,4815,https://example.com/bookcovers/495.jpg,https://example.com/bookcovers/small/495.jpg,"Literary Fiction, Non-fiction, Horror",This is a fictional description for the book 'The Bay' by John Taylor.,4
