book_id,user_id,rating,id,best_book_id,work_id,books_count,isbn,isbn13,authors,original_publication_year,original_title,title,language_code,average_rating,ratings_count,work_ratings_count,work_text_reviews_count,ratings_1,ratings_2,ratings_3,ratings_4,ratings_5,image_url,small_image_url,genres,description,rank
144,505,2,144,144,144,1,23053163,6070687165725,Sarah Smith,2024.0,MacLaurin's Lady,MacLaurin's Lady,eng,2.43,7346,7346,734,2203,1836,1469,1101,737,https://example.com/bookcovers/144.jpg,https://example.com/bookcovers/small/144.jpg,Young Adult,This is a fictional description for the book 'MacLaurin's Lady' by Sarah Smith.,0
132,1665,3,132,132,132,1,6121904522,4785996646055,John Smith,1984.0,"Das einzige Kind, Im Zeichen des Löwen","Das einzige Kind, Im Zeichen des Löwen",eng,4.94,19,19,1,0,0,1,4,14,https://example.com/bookcovers/132.jpg,https://example.com/bookcovers/small/132.jpg,"Non-fiction, Fantasy, Self-help","This is a fictional description for the book 'Das einzige Kind, Im Zeichen des Löwen' by John Smith.",1
464,1957,4,464,464,464,1,2670447309,8520825787792,"Linda Miller, John Moore, Linda Thomas",2012.0,Deadly Force,Deadly Force,eng,2.96,1939,1939,193,581,484,387,290,197,https://example.com/bookcovers/464.jpg,https://example.com/bookcovers/small/464.jpg,"Fantasy, Literary Fiction","This is a fictional description for the book 'Deadly Force' by Linda Miller, John Moore, Linda Thomas.",2
237,1303,5,237,237,237,1,5541460815,7620338649491,"Jennifer Miller, James Wilson",2007.0,Walking and climbing,Walking and climbing,eng,4.25,6853,6853,685,137,548,1027,2398,2743,https://example.com/bookcovers/237.jpg,https://example.com/bookcovers/small/237.jpg,"Young Adult, Thriller","This is a fictional description for the book 'Walking and climbing' by Jennifer Miller, James Wilson.",3
112,1302,4,112,112,112,1,6475801382,58265277947,"James Johnson, David Thomas",1959.0,Palatul de hârtie,Palatul de hârtie,eng,2.7,194,194,19,58,48,38,29,21,https://example.com/bookcovers/112.jpg,https://example.com/bookcovers/small/112.jpg,"Self-help, Literary Fiction","This is a fictional description for the book 'Palatul de hârtie' by James Johnson, David Thomas.",4
