book_id,user_id,rating,id,best_book_id,work_id,books_count,isbn,isbn13,authors,original_publication_year,original_title,title,language_code,average_rating,ratings_count,work_ratings_count,work_text_reviews_count,ratings_1,ratings_2,ratings_3,ratings_4,ratings_5,image_url,small_image_url,genres,description,rank
225,1584,4,225,225,225,1,8294107989,5840843163131,"Jennifer Thomas, Linda Miller",1980.0,Girls out late (Girls #3),Girls out late (Girls #3),eng,1.6,8579,8579,857,2573,2144,1715,1286,861,https://example.com/bookcovers/225.jpg,https://example.com/bookcovers/small/225.jpg,"Romance, Young Adult","This is a fictional description for the book 'Girls out late (Girls #3)' by Jennifer Thomas, Linda Miller.",0
260,592,4,260,260,260,1,8224609452,5364034622243,"Jennifer Thomas, David Anderson, Michelle Davis",2000.0,The Holiday Trap,The Holiday Trap,eng,4.44,6281,6281,628,125,502,942,2198,2514,https://example.com/bookcovers/260.jpg,https://example.com/bookcovers/small/260.jpg,"Thriller, Young Adult, Self-help","This is a fictional description for the book 'The Holiday Trap' by Jennifer Thomas, David Anderson, Michelle Davis.",1
167,1308,5,167,167,167,1,2684323483,2926053121762,"John Brown, John Thomas",2018.0,The Science of Storytelling,The Science of Storytelling,eng,1.66,1888,1888,188,566,472,377,283,190,https://example.com/bookcovers/167.jpg,https://example.com/bookcovers/small/167.jpg,Self-help,"This is a fictional description for the book 'The Science of Storytelling' by John Brown, John Thomas.",2
492,1140,4,492,492,492,1,8314500627,2001713704033,"John Anderson, David Brown",1948.0,Shelter folks,Shelter folks,eng,2.05,8280,8280,828,2484,2070,1656,1242,828,https://example.com/bookcovers/492.jpg,https://example.com/bookcovers/small/492.jpg,"Mystery, Thriller","This is a fictional description for the book 'Shelter folks' by John Anderson, David Brown.",3
66,518,5,66,66,66,1,1940427054,9735688257853,Emily Thomas,1925.0,Jilted,Jilted,eng,2.37,3286,3286,328,985,821,657,492,331,https://example.com/bookcovers/66.jpg,https://example.com/bookcovers/small/66.jpg,"Literary Fiction, Young Adult, Mystery",This is a fictional description for the book 'Jilted' by Emily Thomas.,4
