book_id,user_id,rating,id,best_book_id,work_id,books_count,isbn,isbn13,authors,original_publication_year,original_title,title,language_code,average_rating,ratings_count,work_ratings_count,work_text_reviews_count,ratings_1,ratings_2,ratings_3,ratings_4,ratings_5,image_url,small_image_url,genres,description,rank
498,965,5,498,498,498,1,778581515,4940949079841,Robert Johnson,2011.0,"Final supplemental environmental impact statement and proposed land use plan amendments for segments 8 and 9 of the Gateway West 500-kV Transmission Line Project, Idaho","Final supplemental environmental impact statement and proposed land use plan amendments for segments 8 and 9 of the Gateway West 500-kV Transmission Line Project, Idaho",eng,3.95,9439,9439,943,471,943,2359,3775,1891,https://example.com/bookcovers/498.jpg,https://example.com/bookcovers/small/498.jpg,"Horror, Science Fiction, Fantasy","This is a fictional description for the book 'Final supplemental environmental impact statement and proposed land use plan amendments for segments 8 and 9 of the Gateway West 500-kV Transmission Line Project, Idaho' by Robert Johnson.",0
57,744,5,57,57,57,1,9888108332,1997154894193,John Miller,1952.0,Mimis Village And How Basic Health Care Transformed It,Mimis Village And How Basic Health Care Transformed It,eng,4.83,9556,9556,955,95,382,955,2389,5735,https://example.com/bookcovers/57.jpg,https://example.com/bookcovers/small/57.jpg,"Thriller, Young Adult",This is a fictional description for the book 'Mimis Village And How Basic Health Care Transformed It' by John Miller.,1
61,805,4,61,61,61,1,5076889290,6588519637982,"Robert Moore, Michelle Smith",1990.0,Something Special,Something Special,eng,2.82,3857,3857,385,1157,964,771,578,387,https://example.com/bookcovers/61.jpg,https://example.com/bookcovers/small/61.jpg,"Science Fiction, Thriller, Mystery","This is a fictional description for the book 'Something Special' by Robert Moore, Michelle Smith.",2
148,1917,4,148,148,148,1,3175533474,4222444879854,"Linda Taylor, James Johnson",2003.0,"Final supplemental environmental impact statement and proposed land use plan amendments for segments 8 and 9 of the Gateway West 500-kV Transmission Line Project, Idaho","Final supplemental environmental impact statement and proposed land use plan amendments for segments 8 and 9 of the Gateway West 500-kV Transmission Line Project, Idaho",eng,2.48,2703,2703,270,810,675,540,405,273,https://example.com/bookcovers/148.jpg,https://example.com/bookcovers/small/148.jpg,"Mystery, Thriller, Romance","This is a fictional description for the book 'Final supplemental environmental impact statement and proposed land use plan amendments for segments 8 and 9 of the Gateway West 500-kV Transmission Line Project, Idaho' by Linda Taylor, James Johnson.",3
127,1956,5,127,127,127,1,2088343701,2807043788208,"Linda Miller, Jennifer Brown",1961.0,Economics For Dummies,Economics For Dummies,eng,3.41,7248,7248,724,724,1087,2899,1812,726,https://example.com/bookcovers/127.jpg,https://example.com/bookcovers/small/127.jpg,Horror,"This is a fictional description for the book 'Economics For Dummies' by Linda Miller, Jennifer Brown.",4
