book_id,user_id,rating,id,best_book_id,work_id,books_count,isbn,isbn13,authors,original_publication_year,original_title,title,language_code,average_rating,ratings_count,work_ratings_count,work_text_reviews_count,ratings_1,ratings_2,ratings_3,ratings_4,ratings_5,image_url,small_image_url,genres,description,rank
221,165,5,221,221,221,1,166021940,4722063818470,"Linda Johnson, Emily Johnson, Michael Anderson",1956.0,Great sects and schisms in Judaism,Great sects and schisms in Judaism,eng,3.2,5232,5232,523,523,784,2092,1308,525,https://example.com/bookcovers/221.jpg,https://example.com/bookcovers/small/221.jpg,"Literary Fiction, Romance, Fantasy","This is a fictional description for the book 'Great sects and schisms in Judaism' by Linda Johnson, Emily Johnson, Michael Anderson.",0
101,57,3,101,101,101,1,6530484819,6221744731680,"Michelle Smith, Michael Thomas, Jennifer Anderson",2017.0,Woodrow Wilson,Woodrow Wilson,eng,2.16,4933,4933,493,1479,1233,986,739,496,https://example.com/bookcovers/101.jpg,https://example.com/bookcovers/small/101.jpg,"Science Fiction, Young Adult, Historical Fiction","This is a fictional description for the book 'Woodrow Wilson' by Michelle Smith, Michael Thomas, Jennifer Anderson.",1
22,1289,2,22,22,22,1,3031445659,529442308651,"Sarah Miller, Jennifer Thomas",1962.0,When the Night Falls,When the Night Falls,eng,2.95,2172,2172,217,651,543,434,325,219,https://example.com/bookcovers/22.jpg,https://example.com/bookcovers/small/22.jpg,Horror,"This is a fictional description for the book 'When the Night Falls' by Sarah Miller, Jennifer Thomas.",2
207,765,5,207,207,207,1,2115649154,6116142060079,"Michael Moore, Michael Anderson",1982.0,Mimis Village And How Basic Health Care Transformed It,Mimis Village And How Basic Health Care Transformed It,eng,3.48,1411,1411,141,141,211,564,352,143,https://example.com/bookcovers/207.jpg,https://example.com/bookcovers/small/207.jpg,"Horror, Self-help, Science Fiction","This is a fictional description for the book 'Mimis Village And How Basic Health Care Transformed It' by Michael Moore, Michael Anderson.",3
477,1856,1,477,477,477,1,1380013623,5940320138866,Emily Moore,1974.0,Economics For Dummies,Economics For Dummies,eng,2.97,8969,8969,896,2690,2242,1793,1345,899,https://example.com/bookcovers/477.jpg,https://example.com/bookcovers/small/477.jpg,"Thriller, Non-fiction, Mystery",This is a fictional description for the book 'Economics For Dummies' by Emily Moore.,4
