book_id,user_id,rating,id,best_book_id,work_id,books_count,isbn,isbn13,authors,original_publication_year,original_title,title,language_code,average_rating,ratings_count,work_ratings_count,work_text_reviews_count,ratings_1,ratings_2,ratings_3,ratings_4,ratings_5,image_url,small_image_url,genres,description,rank
410,923,5,410,410,410,1,443240748,4753234723706,David Moore,1977.0,The Holiday Trap,The Holiday Trap,eng,1.39,312,312,31,93,78,62,46,33,https://example.com/bookcovers/410.jpg,https://example.com/bookcovers/small/410.jpg,"Mystery, Biography, Fantasy",This is a fictional description for the book 'The Holiday Trap' by David Moore.,0
323,66,4,323,323,323,1,5833409459,4946380725975,"Linda Smith, Michael Anderson",1916.0,The lady of secrets,The lady of secrets,eng,4.71,1790,1790,179,17,71,179,447,1076,https://example.com/bookcovers/323.jpg,https://example.com/bookcovers/small/323.jpg,Thriller,"This is a fictional description for the book 'The lady of secrets' by Linda Smith, Michael Anderson.",1
177,1717,3,177,177,177,1,3607206637,8795938794821,"Jennifer Anderson, Linda Davis, John Johnson",1964.0,Economics For Dummies,Economics For Dummies,eng,2.15,1311,1311,131,393,327,262,196,133,https://example.com/bookcovers/177.jpg,https://example.com/bookcovers/small/177.jpg,"Non-fiction, Historical Fiction, Science Fiction","This is a fictional description for the book 'Economics For Dummies' by Jennifer Anderson, Linda Davis, John Johnson.",2
383,392,5,383,383,383,1,2086213362,4077413774173,Jennifer Wilson,2023.0,Las estrellas nos atacan,Las estrellas nos atacan,eng,4.96,7018,7018,701,70,280,701,1754,4213,https://example.com/bookcovers/383.jpg,https://example.com/bookcovers/small/383.jpg,"Fantasy, Self-help, Horror",This is a fictional description for the book 'Las estrellas nos atacan' by Jennifer Wilson.,3
300,215,5,300,300,300,1,8488560022,7321105252234,"Emily Wilson, Robert Miller, Linda Anderson",2008.0,The Height of the Scream,The Height of the Scream,eng,1.96,80,80,8,24,20,16,12,8,https://example.com/bookcovers/300.jpg,https://example.com/bookcovers/small/300.jpg,"Science Fiction, Horror, Self-help","This is a fictional description for the book 'The Height of the Scream' by Emily Wilson, Robert Miller, Linda Anderson.",4
