book_id,user_id,rating,id,best_book_id,work_id,books_count,isbn,isbn13,authors,original_publication_year,original_title,title,language_code,average_rating,ratings_count,work_ratings_count,work_text_reviews_count,ratings_1,ratings_2,ratings_3,ratings_4,ratings_5,image_url,small_image_url,genres,description,rank
500,203,5,500,500,500,1,2927765867,6302073586246,"Robert Moore, David Moore, Robert Brown",1946.0,The Height of the Scream,The Height of the Scream,eng,3.03,2157,2157,215,215,323,862,539,218,https://example.com/bookcovers/500.jpg,https://example.com/bookcovers/small/500.jpg,"Mystery, Horror, Biography","This is a fictional description for the book 'The Height of the Scream' by Robert Moore, David Moore, Robert Brown.",0
343,207,5,343,343,343,1,6317488398,4118719366394,"Linda Thomas, James Smith, Jennifer Johnson",1966.0,"The Enlightened Way to Financial Freedom: From Crypto Trading to Private Label, from Startup to Real Estate Investing. The All-in-One Guide to Be Young and Rich","The Enlightened Way to Financial Freedom: From Crypto Trading to Private Label, from Startup to Real Estate Investing. The All-in-One Guide to Be Young and Rich",eng,1.85,7260,7260,726,2178,1815,1452,1089,726,https://example.com/bookcovers/343.jpg,https://example.com/bookcovers/small/343.jpg,"Thriller, Horror, Historical Fiction","This is a fictional description for the book 'The Enlightened Way to Financial Freedom: From Crypto Trading to Private Label, from Startup to Real Estate Investing. The All-in-One Guide to Be Young and Rich' by Linda Thomas, James Smith, Jennifer Johnson.",1
155,139,2,155,155,155,1,6392431489,2283338713048,"Michelle Miller, Robert Davis",1960.0,A Bag of Bones N' Chocolate Biscuits,A Bag of Bones N' Chocolate Biscuits,eng,1.98,9696,9696,969,2908,2424,1939,1454,971,https://example.com/bookcovers/155.jpg,https://example.com/bookcovers/small/155.jpg,"Romance, Mystery","This is a fictional description for the book 'A Bag of Bones N' Chocolate Biscuits' by Michelle Miller, Robert Davis.",2
167,1308,5,167,167,167,1,2684323483,2926053121762,"John Brown, John Thomas",2018.0,The Science of Storytelling,The Science of Storytelling,eng,1.66,1888,1888,188,566,472,377,283,190,https://example.com/bookcovers/167.jpg,https://example.com/bookcovers/small/167.jpg,Self-help,"This is a fictional description for the book 'The Science of Storytelling' by John Brown, John Thomas.",3
301,521,5,301,301,301,1,9787632310,7539587779028,"Sarah Miller, Emily Johnson, James Thomas",1976.0,Woodrow Wilson,Woodrow Wilson,eng,2.37,1350,1350,135,405,337,270,202,136,https://example.com/bookcovers/301.jpg,https://example.com/bookcovers/small/301.jpg,Young Adult,"This is a fictional description for the book 'Woodrow Wilson' by Sarah Miller, Emily Johnson, James Thomas.",4
