book_id,user_id,rating,id,best_book_id,work_id,books_count,isbn,isbn13,authors,original_publication_year,original_title,title,language_code,average_rating,ratings_count,work_ratings_count,work_text_reviews_count,ratings_1,ratings_2,ratings_3,ratings_4,ratings_5,image_url,small_image_url,genres,description,rank
364,969,4,364,364,364,1,6470946945,5776300983126,Sarah Johnson,2016.0,Deadly Force,Deadly Force,eng,4.06,6484,6484,648,129,518,972,2269,2596,https://example.com/bookcovers/364.jpg,https://example.com/bookcovers/small/364.jpg,Science Fiction,This is a fictional description for the book 'Deadly Force' by Sarah Johnson.,0
456,1985,1,456,456,456,1,2207971484,168339981822,"Emily Davis, Linda Davis, David Moore",1911.0,The Gumma wars,The Gumma wars,eng,3.28,366,366,36,36,54,146,91,39,https://example.com/bookcovers/456.jpg,https://example.com/bookcovers/small/456.jpg,Fantasy,"This is a fictional description for the book 'The Gumma wars' by Emily Davis, Linda Davis, David Moore.",1
184,801,2,184,184,184,1,399937576,9725564637147,"Linda Anderson, Linda Smith, Jennifer Miller",2018.0,Autoritratto: Storia e tecnologia dell'immagine di sé dall'antichità a selfie,Autoritratto: Storia e tecnologia dell'immagine di sé dall'antichità a selfie,eng,2.21,9311,9311,931,2793,2327,1862,1396,933,https://example.com/bookcovers/184.jpg,https://example.com/bookcovers/small/184.jpg,"Horror, Romance, Science Fiction","This is a fictional description for the book 'Autoritratto: Storia e tecnologia dell'immagine di sé dall'antichità a selfie' by Linda Anderson, Linda Smith, Jennifer Miller.",2
84,1636,4,84,84,84,1,2575578202,1956974116203,"Linda Thomas, Michelle Thomas, Linda Thomas",1954.0,Autoritratto: Storia e tecnologia dell'immagine di sé dall'antichità a selfie,Autoritratto: Storia e tecnologia dell'immagine di sé dall'antichità a selfie,eng,2.5,1348,1348,134,404,337,269,202,136,https://example.com/bookcovers/84.jpg,https://example.com/bookcovers/small/84.jpg,"Self-help, Horror, Literary Fiction","This is a fictional description for the book 'Autoritratto: Storia e tecnologia dell'immagine di sé dall'antichità a selfie' by Linda Thomas, Michelle Thomas, Linda Thomas.",3
291,1994,4,291,291,291,1,1412425762,3000586854318,Jennifer Thomas,1931.0,The Wandering Inn: Book 2 - Fae and Fare,The Wandering Inn: Book 2 - Fae and Fare,eng,3.0,4924,4924,492,492,738,1969,1231,494,https://example.com/bookcovers/291.jpg,https://example.com/bookcovers/small/291.jpg,"Historical Fiction, Self-help, Mystery",This is a fictional description for the book 'The Wandering Inn: Book 2 - Fae and Fare' by Jennifer Thomas.,4
