book_id,user_id,rating,id,best_book_id,work_id,books_count,isbn,isbn13,authors,original_publication_year,original_title,title,language_code,average_rating,ratings_count,work_ratings_count,work_text_reviews_count,ratings_1,ratings_2,ratings_3,ratings_4,ratings_5,image_url,small_image_url,genres,description,rank
274,1301,3,274,274,274,1,3469068811,8807390036674,"Michelle Taylor, Emily Miller, Jennifer Davis",1948.0,We Are Theologians: Strengthening the People of God,We Are Theologians: Strengthening the People of God,eng,2.02,2271,2271,227,681,567,454,340,229,https://example.com/bookcovers/274.jpg,https://example.com/bookcovers/small/274.jpg,"Young Adult, Historical Fiction, Fantasy","This is a fictional description for the book 'We Are Theologians: Strengthening the People of God' by Michelle Taylor, Emily Miller, Jennifer Davis.",0
16,1081,5,16,16,16,1,8871734887,32785304954,"David Moore, Michelle Smith",1904.0,Jilted,Jilted,eng,2.98,3213,3213,321,963,803,642,481,324,https://example.com/bookcovers/16.jpg,https://example.com/bookcovers/small/16.jpg,"Non-fiction, Fantasy","This is a fictional description for the book 'Jilted' by David Moore, Michelle Smith.",1
246,682,5,246,246,246,1,1057271189,2268825259643,"Linda Wilson, John Anderson, Sarah Wilson",1963.0,The Boyband Murder Mystery,The Boyband Murder Mystery,eng,2.4,5491,5491,549,1647,1372,1098,823,551,https://example.com/bookcovers/246.jpg,https://example.com/bookcovers/small/246.jpg,"Historical Fiction, Romance","This is a fictional description for the book 'The Boyband Murder Mystery' by Linda Wilson, John Anderson, Sarah Wilson.",2
328,186,3,328,328,328,1,1866772288,2969831248594,"David Davis, Sarah Anderson",1925.0,Hunt for the Shadow Wolf: The lost history of wolves in Britain and the myths and stories that surround them,Hunt for the Shadow Wolf: The lost history of wolves in Britain and the myths and stories that surround them,eng,4.78,2216,2216,221,22,88,221,554,1331,https://example.com/bookcovers/328.jpg,https://example.com/bookcovers/small/328.jpg,"Literary Fiction, Thriller, Mystery","This is a fictional description for the book 'Hunt for the Shadow Wolf: The lost history of wolves in Britain and the myths and stories that surround them' by David Davis, Sarah Anderson.",3
488,1568,4,488,488,488,1,2221799264,8974277852978,"Sarah Miller, Michelle Davis",2019.0,ASURA SOVEREIGN 30,ASURA SOVEREIGN 30,eng,2.86,9402,9402,940,2820,2350,1880,1410,942,https://example.com/bookcovers/488.jpg,https://example.com/bookcovers/small/488.jpg,"Non-fiction, Romance","This is a fictional description for the book 'ASURA SOVEREIGN 30' by Sarah Miller, Michelle Davis.",4
