book_id,user_id,rating,id,best_book_id,work_id,books_count,isbn,isbn13,authors,original_publication_year,original_title,title,language_code,average_rating,ratings_count,work_ratings_count,work_text_reviews_count,ratings_1,ratings_2,ratings_3,ratings_4,ratings_5,image_url,small_image_url,genres,description,rank
293,817,4,293,293,293,1,9683293651,8237144473656,"Emily Miller, Michelle Davis",1952.0,"The Enlightened Way to Financial Freedom: From Crypto Trading to Private Label, from Startup to Real Estate Investing. The All-in-One Guide to Be Young and Rich","The Enlightened Way to Financial Freedom: From Crypto Trading to Private Label, from Startup to Real Estate Investing. The All-in-One Guide to Be Young and Rich",eng,4.34,8890,8890,889,177,711,1333,3111,3558,https://example.com/bookcovers/293.jpg,https://example.com/bookcovers/small/293.jpg,Horror,"This is a fictional description for the book 'The Enlightened Way to Financial Freedom: From Crypto Trading to Private Label, from Startup to Real Estate Investing. The All-in-One Guide to Be Young and Rich' by Emily Miller, Michelle Davis.",0
439,1468,3,439,439,439,1,6647759438,3066754198363,"John Johnson, John Moore, Sarah Brown",1940.0,"When Church Stops Working: A Future for Your Congregation beyond More Money, Programs, and Innovation","When Church Stops Working: A Future for Your Congregation beyond More Money, Programs, and Innovation",eng,2.36,1099,1099,109,329,274,219,164,113,https://example.com/bookcovers/439.jpg,https://example.com/bookcovers/small/439.jpg,Biography,"This is a fictional description for the book 'When Church Stops Working: A Future for Your Congregation beyond More Money, Programs, and Innovation' by John Johnson, John Moore, Sarah Brown.",1
383,1516,5,383,383,383,1,9694696191,4539030654762,"Jennifer Thomas, Robert Wilson",1983.0,Las estrellas nos atacan,Las estrellas nos atacan,eng,1.89,4107,4107,410,1232,1026,821,616,412,https://example.com/bookcovers/383.jpg,https://example.com/bookcovers/small/383.jpg,Literary Fiction,"This is a fictional description for the book 'Las estrellas nos atacan' by Jennifer Thomas, Robert Wilson.",2
250,1386,4,250,250,250,1,4847518016,3273927224241,"Michelle Johnson, Linda Taylor",1963.0,The Height of the Scream,The Height of the Scream,eng,1.88,7780,7780,778,2334,1945,1556,1167,778,https://example.com/bookcovers/250.jpg,https://example.com/bookcovers/small/250.jpg,Fantasy,"This is a fictional description for the book 'The Height of the Scream' by Michelle Johnson, Linda Taylor.",3
331,1166,2,331,331,331,1,4529406936,2531640189312,"Emily Johnson, Jennifer Wilson",1915.0,The Abode,The Abode,eng,1.15,9264,9264,926,2779,2316,1852,1389,928,https://example.com/bookcovers/331.jpg,https://example.com/bookcovers/small/331.jpg,"Thriller, Mystery","This is a fictional description for the book 'The Abode' by Emily Johnson, Jennifer Wilson.",4
