book_id,user_id,rating,id,best_book_id,work_id,books_count,isbn,isbn13,authors,original_publication_year,original_title,title,language_code,average_rating,ratings_count,work_ratings_count,work_text_reviews_count,ratings_1,ratings_2,ratings_3,ratings_4,ratings_5,image_url,small_image_url,genres,description,rank
237,721,4,237,237,237,1,7544761611,1458120225627,Jennifer Anderson,1948.0,Walking and climbing,Walking and climbing,eng,1.4,7330,7330,733,2199,1832,1466,1099,734,https://example.com/bookcovers/237.jpg,https://example.com/bookcovers/small/237.jpg,"Romance, Thriller",This is a fictional description for the book 'Walking and climbing' by Jennifer Anderson.,0
147,1731,4,147,147,147,1,2407780763,5696894954738,"Linda Brown, Jennifer Taylor, James Miller",1961.0,Misfortune Cookie,Misfortune Cookie,eng,4.31,1381,1381,138,27,110,207,483,554,https://example.com/bookcovers/147.jpg,https://example.com/bookcovers/small/147.jpg,"Science Fiction, Fantasy","This is a fictional description for the book 'Misfortune Cookie' by Linda Brown, Jennifer Taylor, James Miller.",1
8,1259,4,8,8,8,1,8407472321,3812159311557,"Linda Anderson, Michelle Brown, Emily Smith",1915.0,World War II,World War II,eng,2.26,1635,1635,163,490,408,327,245,165,https://example.com/bookcovers/8.jpg,https://example.com/bookcovers/small/8.jpg,Historical Fiction,"This is a fictional description for the book 'World War II' by Linda Anderson, Michelle Brown, Emily Smith.",2
431,1476,4,431,431,431,1,8915503863,958379690185,"Michael Taylor, John Miller, Jennifer Brown",2005.0,The Abode,The Abode,eng,2.83,1268,1268,126,380,317,253,190,128,https://example.com/bookcovers/431.jpg,https://example.com/bookcovers/small/431.jpg,"Self-help, Fantasy, Literary Fiction","This is a fictional description for the book 'The Abode' by Michael Taylor, John Miller, Jennifer Brown.",3
247,1985,4,247,247,247,1,8042633976,1765316482943,David Smith,1949.0,Misfortune Cookie,Misfortune Cookie,eng,1.91,4097,4097,409,1229,1024,819,614,411,https://example.com/bookcovers/247.jpg,https://example.com/bookcovers/small/247.jpg,"Literary Fiction, Horror, Self-help",This is a fictional description for the book 'Misfortune Cookie' by David Smith.,4
