book_id,user_id,rating,id,best_book_id,work_id,books_count,isbn,isbn13,authors,original_publication_year,original_title,title,language_code,average_rating,ratings_count,work_ratings_count,work_text_reviews_count,ratings_1,ratings_2,ratings_3,ratings_4,ratings_5,image_url,small_image_url
3,314,3,2,3,4640799,491,439554934,9780439554930.0,"J.K. Rowling, Mary GrandPré",1997.0,Harry Potter and the Philosopher's Stone,"Harry Potter and the Sorcerer's Stone (Harry Potter, #1)",eng,4.44,4602479,4800065,75867,75504,101676,455024,1156318,3011543,https://images.gr-assets.com/books/1474154022m/3.jpg,https://images.gr-assets.com/books/1474154022s/3.jpg
8,588,3,3275,8,21457576,11,439682584,9780439682590.0,"J.K. Rowling, Mary GrandPré",2003.0,,"Harry Potter Boxed Set, Books 1-5 (Harry Potter, #1-5)",eng,4.77,33220,33424,156,317,233,978,3686,28210,https://s.gr-assets.com/assets/nophoto/book/111x148-bcc042a9c91a29c1d680899eff700a03.png,https://s.gr-assets.com/assets/nophoto/book/50x75-a91bf249278a81aabab721ef782c4a74.png
10,3662,4,3753,10,21457570,6,439827604,9780439827610.0,J.K. Rowling,2005.0,"Harry Potter Collection (Harry Potter, #1-6)","Harry Potter Collection (Harry Potter, #1-6)",eng,4.73,24618,26274,882,203,186,946,3891,21048,https://images.gr-assets.com/books/1328867351m/10.jpg,https://images.gr-assets.com/books/1328867351s/10.jpg
119,951,5,3230,119,4479,7,618212906,9780618212900.0,Gary Russell,2002.0,The Lord of the Rings: The Art of The Fellowship of the Ring,The Lord of the Rings: The Art of The Fellowship of the Ring,en-US,4.59,24340,24412,67,211,220,1751,5011,17219,https://s.gr-assets.com/assets/nophoto/book/111x148-bcc042a9c91a29c1d680899eff700a03.png,https://s.gr-assets.com/assets/nophoto/book/50x75-a91bf249278a81aabab721ef782c4a74.png
9791,57,3,316,9791,613469,95,307279464,9780307279460.0,Bill Bryson,1997.0,A Walk in the Woods,A Walk in the Woods,eng,4.05,250192,264449,14422,3553,10293,50487,104690,95426,https://s.gr-assets.com/assets/nophoto/book/111x148-bcc042a9c91a29c1d680899eff700a03.png,https://s.gr-assets.com/assets/nophoto/book/50x75-a91bf249278a81aabab721ef782c4a74.png
